Title,Authors,DOI,DOI link,Venue,Citation count,Year,TEMPORAL & CONTROL VARIABLES,MODEL FIT & PERFORMANCE METRICS,MAJOR FINDINGS & RESULTS,ENVIRONMENTAL & CRIME ATTRACTOR VARIABLES,DISTANCE & ACCESSIBILITY VARIABLES,"Supporting quotes for ""TEMPORAL & CONTROL VARIABLES""","Supporting  tables for ""TEMPORAL & CONTROL VARIABLES""","Reasoning for ""TEMPORAL & CONTROL VARIABLES""","Supporting quotes for ""MODEL FIT & PERFORMANCE METRICS""","Supporting  tables for ""MODEL FIT & PERFORMANCE METRICS""","Reasoning for ""MODEL FIT & PERFORMANCE METRICS""","Supporting quotes for ""MAJOR FINDINGS & RESULTS""","Supporting  tables for ""MAJOR FINDINGS & RESULTS""","Reasoning for ""MAJOR FINDINGS & RESULTS""","Supporting quotes for ""ENVIRONMENTAL & CRIME ATTRACTOR VARIABLES""","Supporting  tables for ""ENVIRONMENTAL & CRIME ATTRACTOR VARIABLES""","Reasoning for ""ENVIRONMENTAL & CRIME ATTRACTOR VARIABLES""","Supporting quotes for ""DISTANCE & ACCESSIBILITY VARIABLES""","Supporting  tables for ""DISTANCE & ACCESSIBILITY VARIABLES""","Reasoning for ""DISTANCE & ACCESSIBILITY VARIABLES"""
TARGET CHOICE DURING EXTREME EVENTS: A DISCRETE SPATIAL CHOICE MODEL OF THE 2011 LONDON RIOTS *,"Peter Baudains, Alex Braithwaite, Shane D Johnson",-,-,,85,2013,"1. Prior Offenses | Count of detected offenses in the previous 24 hours | Number | Police data
2. Propinquity | Distance from offender's residence to offense location | Kilometers | Police data
3. Contagion | Number of offenses in an area in the previous 24 hours | Number | Police data
4. Discrete Choice Approach | Method for modeling individual choices | - | Statistical model
5. Population Churn Rates | Measure of population change | Rate | 2001 U.K. Census
6. Ethnic Heterogeneity | Measure of ethnic diversity | Index | 2001 U.K. Census
7. Deprivation | Index of Multiple Deprivation | Index | U.K. Department for Communities and Local Government
8. Population Density | Measure of population per area | Density | Mid-2010 population estimates
9. McFadden Pseudo R-squared | Measure of model fit | R-squared value | Statistical model","- **Model Performance:** Pseudo R-squared: 0.34
- **Information Criteria:** Not mentioned
- **Goodness-of-Fit Tests:** Not mentioned
- **Model Comparison:** Results are robust to inclusion of additional variables
- **Sample Size Effects:** Not mentioned
- **Convergence Issues:** Not mentioned","- **Main Results:** Rioters' target choices were not random and were influenced by proximity to home, presence of schools, transport hubs, retail facilities, and previous rioting activity.
- **Significant Predictors:** Proximity to home, schools, transport hubs, retail facilities, previous rioting activity, deprivation, population churn.
- **Effect Directions:** Increased likelihood for areas close to home, with schools, transport hubs, retail facilities, and previous rioting; decreased likelihood for crossing the Thames River.
- **Effect Magnitudes:** Odds ratios: proximity (0.6 reduction per kilometer), schools (1.29 to 2.09 increase), retail facilities (1.28 increase), previous rioting (1.14 increase), deprivation (1.27 to 1.63 increase), population churn (1.20 increase).
- **Surprising Findings:** Contagion effect from previous rioting activity.
- **Robustness Checks:** Consistency across days and alternative model specifications.","1. Routine Activity Nodes | Places frequently visited or spent time at | - | Paper
2. Transport Hubs | Areas with transport infrastructure like train stations | - | Paper
3. Retail Centers | Areas with retail facilities | 250 m^2 | Paper
4. Schools | Educational institutions | - | Paper
5. River Thames | Natural barrier affecting movement | - | Paper","1. Home-to-crime distance | Distance from offender's home to crime location | Kilometers | Police data
2. Distance to city center | Distance from LSOA centroid to London city center | Kilometers | Police data
3. Presence of underground station | Indicator of underground station presence in LSOA | Binary | Open Street Map
4. Thames River barrier | Presence of Thames River as a barrier | Binary | Geographic data
5. Propinquity | Proximity of area to offender's residence | Kilometers | Police data
6. Contagion measure | Number of offenses in previous 24 hours | Count | Police data","  - ""to measure the effect that prior offenses at a location have on the spatial decision making of a new potential rioter, for each event level decision, we count the number of detected offenses that were identified by the police as having been associated with the riots that occurred at each LSOA within the previous 24 hours of that decision.""
  - ""The results suggest an unequivocal effect of propinquity (hypothesis 1) on offender spatial decision making, with offenders (young or old) being more likely to target areas that were closer to their area of residence.""
  - ""The variable used to measure contagion (hypothesis 11)-indicating the number of offenses in each area in the previous 24 hours-was significantly associated with target choice during the London riots, as expected.""
  - ""In terms of formal methods for modeling decision making of this kind, the discrete choice approach is a class of model that concerns an individual's choice between a set of two or more discrete alternatives""
  - ""The estimates of population churn rates and ethnic heterogeneity were derived using data from the 2001 U.K. Census.""
  - ""To measure deprivation, we use the Index of Multiple Deprivation (IMD) 2010 obtained from the U.K. Department for Communities and Local Government""
  - ""In addition to the variables discussed, a measure of population density is included in the model.""
  - ""The results also were found to be consistent when the standard errors Considering overall model fit, as is observed from table 5, the average McFadden pseudo R-squared across all days of rioting is about .34.""",,"- The paper uses a temporal variable to measure the effect of prior offenses on new rioter spatial decision making, which is the count of detected offenses in the previous 24 hours (Quote 1).
- The distance from an offender's residence to the offense location is a spatial control variable, as it affects the likelihood of targeting an area (Quote 2).
- The contagion variable, which measures the number of offenses in an area in the previous 24 hours, is another temporal control (Quote 3).
- The discrete choice approach is a methodological control, as it models individual choices between discrete alternatives (Quote 4).
- Population churn rates and ethnic heterogeneity are control variables derived from census data, which are used to assess social disorganization (Quote 5).
- Deprivation is measured using the Index of Multiple Deprivation, which is a control variable for social disorganization (Quote 6).
- Population density is included as a control variable to account for its potential effects on offender decision making (Quote 7).
- The use of McFadden pseudo R-squared indicates a statistical control for model fit (Quote 8).","  - ""Considering overall model fit, as is observed from table 5, the average McFadden pseudo R-squared across all days of rioting is about .34.""
  - ""The results also were found to be consistent when the standard errors Considering overall model fit, as is observed from table 5, the average McFadden pseudo R-squared across all days of rioting is about .34.""
  - ""The results presented are robust to the inclusion of two other variables: a measure of police strength and a measure of police relations in the destination areas.""",,"- The paper provides a pseudo R-squared value of approximately 0.34, which is considered an excellent fit according to McFadden (1979).
- The paper does not mention any other specific model performance metrics such as R-squared or log-likelihood values.
- There is no mention of information criteria like AIC or BIC.
- The paper does not report any goodness-of-fit tests such as Chi-square tests or likelihood ratio tests.
- The paper mentions that the results are robust to the inclusion of additional variables, which suggests a form of model comparison, but no specific statistical comparison is provided.
- There is no discussion of sample size effects on model performance.
- There are no convergence issues mentioned in the paper.","  - ""The results demonstrate that rioter target choices were far from random and provide support for all three types of theory, but for crime pattern theory in particular.""
  - ""rioters were more likely to engage in the disorder close to their home location and to select areas that contained routine activity nodes and transport hubs, and they were less likely to cross the Thames River.""
  - ""In terms of contagion, rioters were found to be more likely to target areas that had experienced rioting in the previous 24 hours.""
  - ""The results suggest an unequivocal effect of propinquity (hypothesis 1) on offender spatial decision making, with offenders (young or old) being more likely to target areas that were closer to their area of residence.""
  - ""Roughly speaking, the odds of an offender selecting an area reduces by a factor of around .6 for every kilometer an area is located from an offender's area of residence.""
  - ""Considering potential (collective) routine activity nodes, all other things being equal, the odds of an offender selecting an area increases by a factor of between 1.29 and 2.09 for every additional school that is located within it""
  - ""the presence of a tube station was a statistically significant predictor of whether an area was selected for August 7 and 9.""
  - ""the odds of an offender selecting an area being up to five times higher if that area is on the same side of the river as that within which he or she lived.""
  - ""the odds of an area being selected increases by a factor of between 1.27 and 1.63 for every 10 unit increase in the index of deprivation.""
  - ""the likelihood of an area being selected increased by a factor of around 1.20 for every 10 unit increase in the churn rate of that area.""
  - ""The variable used to measure contagion (hypothesis 11)-indicating the number of offenses in each area in the previous 24 hours-was significantly associated with target choice during the London riots,""
  - ""the odds of an area being targeted by an offender increased by a factor of 1.14 for every additional (detected) incident that occurred in that area in the previous 24 hours.""
  - ""The results also were found to be consistent when the standard errors Considering overall model fit, as is observed from table 5, the average McFadden pseudo R-squared across all days of rioting is about .34.""",,"- The main results indicate that rioters' target choices were not random and were influenced by several factors, with crime pattern theory being particularly supported.
- Significant predictors include proximity to home location, presence of schools, transport hubs, retail facilities, and areas with previous rioting activity.
- The effect directions show that rioters were more likely to target areas close to home, with schools, transport hubs, and retail facilities, and less likely to cross the Thames River.
- Effect magnitudes are provided in terms of odds ratios: for example, a 0.6 reduction in odds for every kilometer from home, and increases in odds for schools (1.29 to 2.09), retail facilities (1.28), and areas with previous rioting (1.14).
- Surprising findings include the significant influence of previous rioting activity on current target choice, suggesting a contagion effect.
- Robustness checks are indicated by the consistency of results across different days and the use of alternative model specifications.","  - ""For example, rioters were more likely to engage in the disorder close to their home location and to select areas that contained routine activity nodes and transport hubs, and they were less likely to cross the Thames River.""
  - ""In the case of rioting, of course, we note that retail centers, in particular, may be targeted simply because they contain opportunities for looting.""
  - ""According to CPT, people create mental maps of their routine activity spaces, which contain several key elements. For example, routine activity nodes represent those places that individuals visit frequently or at which they spend much of their time.""
  - ""Prominent features of the urban environment also are expected to shape the awareness spaces of people. For example, much of the population will be familiar with, and may spend a significant amount of time at, local landmarks, including retail centers, transport hubs such as train stations, and schools""
  - ""the presence of a tube station was a statistically significant predictor of whether an area was selected for August 7 and 9.""
  - ""the odds of an offender selecting an area increases by a factor of between 1.29 and 2.09 for every additional school that is located within it""
  - ""the odds of an offender selecting an area being up to five times higher if that area is on the same side of the river as that within which he or she lived.""",,"- The paper discusses the role of ""routine activity nodes"" and ""transport hubs"" as attractors for rioters, which are related to land use and crime attractors.
- Retail centers are mentioned as targets due to opportunities for looting, which is a crime attractor.
- The presence of tube stations is highlighted as a significant predictor for area selection, which is a built environment feature.
- The paper mentions the influence of schools on offender spatial decision making, which is a crime attractor.
- The River Thames is noted as a natural barrier affecting offender behavior, which is a physical environment variable.
- The paper does not explicitly mention other environmental or crime attractor variables such as parks, terrain, or specific building types, but it does focus on the role of retail and transport hubs.","  - ""The results demonstrate that rioter target choices were far from random and provide support for all three types of theory, but for crime pattern theory in particular. For example, rioters were more likely to engage in the disorder close to their home location and to select areas that contained routine activity nodes and transport hubs, and they were less likely to cross the Thames River.""
  - ""In terms of contagion, rioters were found to be more likely to target areas that had experienced rioting in the previous 24 hours.""
  - ""The distance from the city center is calculated as the distance between the centroid of each LSOA and the center of London (measured as a point just south of Trafalgar Square: longitude -.1277, latitude 51.5073) in kilometers.""
  - ""To determine whether an underground station is located within an LSOA, we use location data of underground stations obtained from Open Street Map (http://www.openstreetmap.org/).""
  - ""The Thames divides London into distinct northern and southern areas, and although bridges connect North and South London, the presence of the Thames can substantially impede movement between the two.""
  - ""The estimates of population churn rates and ethnic heterogeneity were derived using data from the 2001 U.K. Census.""
  - ""The variable used to measure contagion (hypothesis 11)-indicating the number of offenses in each area in the previous 24 hours-was significantly associated with target choice during the London riots, as expected.""
  - ""The results suggest an unequivocal effect of propinquity (hypothesis 1) on offender spatial decision making, with offenders (young or old) being more likely to target areas that were closer to their area of residence.""
  - ""the presence of a tube station was a statistically significant predictor of whether an area was selected for August 7 and 9.""
  - ""the odds of an offender selecting an area being up to five times higher if that area is on the same side of the river as that within which he or she lived.""",,"- The paper discusses several distance and accessibility variables relevant to the spatial decision-making of rioters.
- The distance from home to crime location is a key variable, as rioters were more likely to engage in disorder close to their home location (Quote 1).
- The distance to the city center is explicitly measured in kilometers (Quote 3).
- The presence of underground stations is used as a measure of accessibility (Quote 4).
- The Thames River acts as a spatial barrier, affecting the likelihood of rioters crossing it (Quotes 1 and 5).
- The study uses a measure of contagion based on recent activity in an area, which can influence spatial decision-making (Quotes 2 and 7).
- Propinquity, or the proximity of an area to an offender's residence, is a significant factor (Quote 8).
- The presence of tube stations is a significant predictor of area selection (Quote 9).
- The odds of selecting an area are higher if it is on the same side of the river as the offender's residence (Quote 10)."
