Title,Year,Authors,Journal,DOI,Filename,Country,City_Region,Study_Area_Size,Crime_Type,Study_Period,Data_Collection_Period,SUoA_Type,SUoA_Size,Number_of_Units,Sample_Size,Number_of_Crimes_Analyzed,Discrete_Choice_Model,Software_Used,Main_Results,Demographic_Variables,Demographic_Count,Economic_Variables,Economic_Count,Environmental_Variables,Environmental_Count,Distance_Variables,Distance_Count,Temporal_Variables,Temporal_Count,Total_Variables
Go where the money is: modeling street robbers' location choices,2015,Wim Bernasco; Richard Block; Stijn Ruiter,Journal of Economic Geography,NA,bernasco_block_ruiter_2015.pdf,United States,Chicago,Not explicitly mentioned in km² or other units,Street robbery,1996,1996,Census block,140m x 140m,"24,594",6000 robberies,"12,938 cleared cases","Multinomial logit, Universal logit",Stata/MP version 11,Street robbers in Chicago prefer easily accessible locations with legal and illegal cash economies.,Total number of residents in the census block; Racial and ethnic composition of the population; Age of offenders; Gender of offenders; Racial and ethnic background of offenders,5,Presence of legal cash economies; Presence of illegal cash economies; Accessibility of a block; Racial and ethnic segregation,4,Presence of legal cash economies; Presence of illegal cash economies; Presence of high schools; Presence of El stations; Land use and activities,5,Euclidean Distance; Accessibility Along Main Streets; Proximity to El Stations; Social Barriers,4,Year; Accessibility; Spatial Lags; Racial/Ethnic Composition,4,22
The usefulness of past crime data as an attractiveness index for residential burglars,2018,Aiko Hanayama; Shumpei Haginoya; Hiroki Kuraishi; Masakazu Kobayashi,NA,NA,NA,Japan,Sendai City,786 km²,Residential burglary,2007,2004,Grid cell,500m x 500m,"1,134",369 solved cases,369,Conditional logit,NA,"Residential burglars are attracted to areas close to their residence, with a higher number of past residential burglaries, more residential units, and a higher proportion of single",Proportion of foreigners; Proportion of newcomers; Number of residential units; Proportion of single-family dwellings,4,Real Estate Value of Residences,1,Number of Residential Units; Proportion of Single-Family Dwellings; Crime Attractors; Road Structure,4,Distance from offender's residence; Distance from city center,2,Number of past residential burglaries; Past residential burglary rate,2,13
Adolescent offenders' current whereabouts predict locations of their future crimes,2019,Wim Bernasco,PLOS ONE,https://doi.org/10.1371/journal.pone.0210733,Bernasco_2019_Adolescent_offenders_current_whereabouts_predict_locations_of_their_future_crimes.pdf,Netherlands,The Hague,NA,Not specified (multiple types),Approximately 4 years,October 2008,Grid cell,200m x 200m,4558,843 adolescents.,165.,Conditional logit,NA,Offenders commit crimes in familiar locations such as their activity spaces and previous crime locations.,Gender; Ethnic background; Age structure; Educational level,4,Educational Qualifications; Points of Interest; Catering Businesses; Retail Businesses; Schools,5,Presence of catering businesses; Presence of retail businesses; Presence of schools; Prior crime locations,4,Radius of Gyration; Distance from Activity Space; Distance from Prior Crime; Contiguity Order,4,Day-of-week weighting; Seasonal measurement period; Time elapsed since interview; Underreporting of crimes,4,21
Where Do Dealers Solicit Customers and Sell Them Drugs? A Micro-Level Multiple Method Study,2015,Wim Bernasco; Scott Jacques,NA,NA,Bernasco_2015_Dealers_Solicit_Customers.pdf,Netherlands,"Amsterdam, Red Light District and neighboring area",Approximately 1 km²,Illicit drug dealing,NA,"April 2009 to May 2010 (interviews), April 23, 2009 to May 28, 2009 (systematic observations)",Street segments,"Average length 103 meters (SD = 65 m, minimum = 16 m, maximum = 425 m)",262,50 dealers interviewed.,"Not explicitly mentioned, but focuses on location choices of 50 dealers.",Multinomial logit,NA,"Dealers prefer locations with high potential customer density for soliciting and selling drugs, but they are not deterred by formal or informal social control.",Gender; Age; Marital Status; Birthplace; Education Level; Population Size; Population Distribution,7,Potential Customer Density; Presence of Retail and Entertainment Businesses; Accessibility; Activity Level,4,"Presence of retail and entertainment businesses; General activity level; Bars, clubs, coffeeshops, and smartshops; CCTV cameras; Territoriality; Physical disorder",6,Accessibility of the location; General activity level of the location; Average length of street segments,3,Time of Day; Day of Week; Social Control; Territoriality; Social Disorder,5,25
Discrete choice analysis of spatial attack sites,2007,Michael A Smith; Ae D E Brown; Donald E Brown,NA,NA,Smith2007DiscreteChoiceAnalysis.pdf,United States,"Richmond, Virginia",NA,Breaking and entering,Third quarter of 1997,"Not explicitly mentioned, but implied to be from existing records for 1997",Grid cell,170m x 191m,"4,895",Training set: 425 crime events; Test set: 212 crime events.,637 distinct spatial selections.,Multinomial logit,R,"Discrete choice models perform as well as or better than traditional hot spot models, offering more interpretable results.",Demographic Profile Variables,1,NA,0,u30; u66,2,u 26; u 27; u 30,3,NA,0,6
Residential burglary target selection: An analysis at the property-level using Google Street View,2017,Samuel H Langton; Wouter Steenbeek,Applied Geography,http:// dx.doi.org/10.1016/j.apgeog.2017.06.014,Langton_2017_Residential_burglary_target_selection,Netherlands,The Hague,NA,Residential burglary,2009,Around 2009,Individual properties (houses),Not specified,300 single houses,"300 single houses (150 burglarized, 150 non",221 break and enter events during daylight hours,Conditional logistic regression,R,"Ease of escape, accessibility, and lack of surveillance are positively related to burglary risk; wealth indicators do not affect victimization likelihood.",Collective Efficacy; Social Trust; Informal Social Control,3,Wealth,1,Surveillability; Accessibility; Ease of Escape,3,Distance to nearest main road; Distance to nearest street corner; Number of escape routes; Property at end of row; Number of boundaries shared with public areas; Property setback from street,6,Case-control design; Presence of business; Mixed land-use; House type; Fixed effects analysis; Alternative neighbourhood boundaries,6,19
