Title,Year,Authors,Journal,DOI,Filename,Country,City_Region,Study_Area_Size,Crime_Type,Study_Period,Data_Collection_Period,SUoA_Type,SUoA_Size,Number_of_Units,Sample_Size,Number_of_Crimes_Analyzed,Discrete_Choice_Model,Software_Used,Main_Results,Demographic_Variables,Demographic_Count,Economic_Variables,Economic_Count,Environmental_Variables,Environmental_Count,Distance_Variables,Distance_Count,Temporal_Variables,Temporal_Count,Total_Variables
TARGET CHOICE DURING EXTREME EVENTS: A DISCRETE SPATIAL CHOICE MODEL OF THE 2011 LONDON RIOTS *,2013,Peter Baudains; Alex Braithwaite; Shane D Johnson,NA,10.1111/1745,Baudains_2013_Target_Choice_During_Extreme_Events.pdf,United Kingdom,London,Not explicitly mentioned in km²,Riot,August 2011,August 2011 (implied),Lower Super Output Areas (LSOA),NA,"4,765","2,299 records with both residential and offense locations.","3,914 total riot",Conditional logit,STATA 10 SE,"Rioters' target choices were not random and were influenced by proximity to home, presence of schools, transport hubs, retail facilities, and previous rioting activity.",Population Churn Rates; Ethnic Heterogeneity; Number of Schools; Age Distribution; Propinquity; Social Disorganization,6,Index of Multiple Deprivation (IMD),1,Routine Activity Nodes; Transport Hubs; Retail Centers; Schools; River Thames,5,Home-to-crime distance; Distance to city center; Presence of underground station; Thames River barrier; Propinquity; Contagion measure,6,Prior Offenses; Propinquity; Contagion; Discrete Choice Approach; Population Churn Rates; Ethnic Heterogeneity; Deprivation; Population Density; McFadden Pseudo R-squared,9,27
a_discrete_spatial_choice_model_of_burglary_target.pdf,NA,NA,NA,NA,a_discrete_spatial_choice_model_of_burglary_target.pdf,Belgium,East Flanders,"nearly 3,000 km²",residential burglaries,2006,Up to 2012,House,Not specified,"503,589",650,650,Conditional logit,R,"Terraced houses, houses without a garage, houses without central heating or air",Population size; Age of burglars; Gender of burglars,3,Built Surface Area; Presence of Garage; Central Heating and Air-Conditioning,3,Construction Type; Presence of Garage; Central Heating and/or Air-Conditioning System; Number of Floors; Presence of Rooftop Living Floor; Built Surface Area,6,Journey-to-crime distance; Average journey-to-crime distance; Odds ratio for distance; Shortest travel path; Temporally optimized distance,5,Time period of recorded crime data; Date of Belgian Land Registry data; Study area; Bootstrapping procedure,4,21
Formal Evaluation of the Impact of Barriers and Connectors on Residential Burglars' Macro-Level Offending Location Choices,2009,Joseph Clare; John Fernandez; Frank Morgan,Journal of Research in Crime and Delinquency,NA,Clare et al. 2009.pdf,Australia,Perth,6.76 km² (average size of suburbs),Residential burglary,"January 1, 2001, to December 31, 2002",2001 and 2002,Residential suburbs,Average size of 6.76 km²,291,"1,761 single","1,761.",Conditional logit,NA,"Physical barriers and connectors significantly influence residential burglars' location choices. Barriers decrease the likelihood of selecting a target suburb, while connectors increase it.",Age; Indigenous Status; Sex; Population Size; Population Density; Ethnic Heterogeneity; Residential Mobility Rates; Total Residential Units,8,Victim Suburb Weekly Income; Socio-Economic Index for Areas (SEIFA); Median Weekly Income Bracket,3,Physical Barriers - Swan River; Physical Barriers - Major Roads; Connectors - Train Network; Land Use - Suburb Size; Land Use - Population Density,5,W ij; F ij; T ij; D ij; A i/J i,5,Time Period; Clustering,2,23
Investigating the effect of people on the street and streetscape physical environment on the location choice of street theft crime offenders using street view images and a discrete spatial choice model,2023,Han Yue; Lin Liu; Luzi Xiao; Y D Wei,NA,NA,Yue_2023_Investigating_the_effect_of_people_on_the_street.pdf,China,"ZG city, southeast China",NA,Street theft crime,2017,"2016, 2017, 2019",Administrative unit (Community),Not specified,1636,"2,519,440 observations.",1540 street theft crimes.,Conditional logit,NA,The inclusion of streetscape variables improves model performance in understanding location choice for street theft crime offenders.,Percent migrants; Number of people on the street,2,Percent migrants; Percent lowly-rent houses,2,Fences; Walls; Windows; Grass; Sidewalks; Plants; Number of people on the street; Commercial interfaces; Shops facing the street; Buildings along the street; Streetlights; Surveillance cameras; Trees; Lawns; ATMs; Banks; Subway stations; Bus stops; Schools; Hospitals,20,Offender Residence-Crime Proximity,1,Residence-crime proximity; Crime attractors; Crime generators; Crime detractors; Percent migrants; Percent lowly-rent houses,6,31
Target Selection Models with Preference Variation Between Offenders,NA,Michael Townsley; Daniel Birks; Stijn Ruiter; Wim Bernasco; Gentry White,NA,NA,Townsley_2009_TargetSelectionModels.pdf,Australia,Brisbane,158 Statistical Local Areas (SLAs),Residential burglary,2006,2006,Statistical Local Areas (SLAs),Not specified,158,2844 detected residential burglaries,2844,Mixed logit,R (RSGHB package),The study found considerable variation in location choice preferences among offenders. The mixed logit model showed a stronger influence of proximity variables compared to the conditional logit model.,Residential mobility; Social cohesion; Ethnicity/race; Collective efficacy,4,Mean housing repayment; Number of households,2,Target Vulnerability; City Center Proximity,2,Proximity to city center; Proximity; Distance to crime,3,NA,0,11
Effects of residential history on commercial robbers' crime location choices,2010,Wim Bernasco; Thessa Kooistra,NA,NA,Bernasco_Kooistra_2010_Effects_of_residential_history_on_commercial_robbers_crime_location_choices.pdf,Netherlands,Nationwide,4006 postal code areas,Commercial robbery,2004,NA,Postal code areas,Varies,4006,276 robberies used for hypothesis testing.,4657 initial robberies; 398 solitary offender robberies; 276 used for analysis.,Conditional logit,NA,"Offenders are more likely to commit crimes in areas where they have lived before, both currently and formerly.",Population density; Population size; Population percentages of 15-25-year-old; Foreign-born residents; Single residents,5,Mean value of residential property; Total floor area of retail businesses,2,Total floor area of retail businesses; Postal code area characteristics,2,Distance to the nearest highway ramp; Distance between current residence and crime location,2,"Total floor area of retail businesses; Distance to the nearest highway ramp; Mean value of residential property; Population density; Population size; Population percentages of 15-25-year-old, foreign-born, and single residents; Distance decay; Duration of residence",8,19
A Time for a Crime: Temporal Aspects of Repeat Offenders' Crime Location Choices,2018,Sabine E M Van Sleeuwen; Stijn Ruiter; Barbara Menting,NA,NA,NA,Netherlands,The greater The Hague area,2.96 km² (average area size per postal code),Not specified (multiple types analyzed),2006 to 2009,2006 to 2009,Administrative unit (four,Average area size of about 2.96 km²,142,"12,639 choice observations.","12,639 offenses.",Conditional logit,NA,"Offenders are more likely to commit crimes in areas they have previously targeted, especially at similar times and days.",Proportion of residents with a non-Western background; Proportion of single-person households; Population density,3,Proportion of residents with a non-Western background; Proportion of single-person households; Population density; Number of employees; Presence of facilities,5,Facilities,1,Euclidean distance; Distance within same postal code area; Accessibility based on distance; Spatial boundaries; Transportation network accessibility,5,Previous crime location on same weekday; Previous crime location on different weekday; Previous crime location on same weekend day; Previous crime location on different weekend day; Previous crime location on different week part; Previous crime location with a . . . hour difference; Offender's current or former residence; Distance from current residential area to the target area; Proportion of residents with a non-Western background; Proportion of single-person households; Population density; Number of employees; Presence of facilities,13,27
A SENTIMENTAL JOURNEY TO CRIME: EFFECTS OF RESIDENTIAL HISTORY ON CRIME LOCATION CHOICE*,2010,Wim Bernasco,NA,10.1111/j.  1745,Bernasco_2010_Sentimental_Journey_to_Crime,Netherlands,Greater The Hague,NA,Multiple,2004,"Not explicitly mentioned, but inferred as during or after 2005",Administrative unit,varies,"approximately 4,000","3,784 offenders","7,179 offenses",Conditional logit (multinomial logit),NA,Offenders prefer to commit crimes in areas where they currently live or have lived in the past.,Population size; Percentage of single-person households; Level of urbanization; Birth; Death; Nationality; Marriage; Divorce; Childbirth; Residential addresses,10,Poverty level; Level of urbanization,2,NA,0,Distance from home to crime location; Distance to current area of residence; Shortest distance to former area of residence,3,Home Hypothesis; History Hypothesis; Recency Hypothesis; Duration Hypothesis; Proximity Hypothesis; Population Size; Percentage of Single-Person Households; Poverty Level; Level of Urbanization; Whether Offender Lives in the Area; Whether Offender Has Lived in the Area Before; Duration of Residence; Time Since Moved Out of the Area; Distance to Current Area of Residence; Distance to Former Area of Residence,15,30
Burglars blocked by barriers? The impact of physical and social barriers on residential burglars' target location choices in China,2021,Luzi Xiao; Stijn Ruiter; Lin Liu; Guangwen Song; Suhong Zhou,NA,NA,Xiao_2021_Burglars_blocked_by_barriers.pdf,China,ZG city,Average community size is 2.74 km,Residential burglary,January 2012 to June 2016,January 2012 to June 2016,Administrative unit (communities),Average size 2.74 km²; varies from 0.01 km² to 82.49 km²,2643,3860 choice observations or events.,3860 residential burglaries.,Conditional logit,Stata/MP version 15,Residential burglars are less likely to target areas on the other side of physical barriers like rivers and major roads. Local burglars prefer communities with a majority local population.,"Proportion of local residents with ZG city Hukou status; Community categorization by majority population type (local, domestic migrant, mixed); Social barriers based on Hukou status; Limited social network overlap; Number of households in a community",5,"Proportion of houses built after 2000; Average rent price; Rent categories (no rent, low, medium, high); Number of households",4,Proportion of high-rise buildings; Proportion of houses built after 2000; Natural log of the number of households; Average rent price,4,Physical Barriers; Distance Measure; Accessibility Measure,3,Time Period; Distance; Affluence Measures; Building Type; Household Count,5,21
FAMILY MATTERS: EFFECTS OF FAMILY MEMBERS' RESIDENTIAL AREAS ON CRIME LOCATION CHOICE *,NA,Barbara Menting; Marre Lammers; Stijn Ruiter; Wim Bernasco,NA,NA,Menting_2023_FamilyMatters.pdf,Netherlands,Greater The Hague area,2.96 km²,Not specified,2006,NA,Four,Average area size of 2.96 km² (range = 0.12 to 24.69 km²),142,"19,420 offenses.","19,420.",Conditional logit,NA,Residential areas of family members are at increased risk of being targeted by offenders.,Population density; Proportion of single-person households; Proportion of residents with a non-Western background; Average population size; Average area size; Urban nature of the study area; Ethnic diversity,7,"Population Density; Proportion of Single-Person Households; Proportion of Residents with a Non-Western Background; Number of Retail Stores; Number of Hotels Restaurants Bars; Number of Schools; Number of Culture, Health-Care, and Sports/Leisure Facilities; Number of People Working",8,"Retail stores; Bars/nightlife; Schools; Culture, health-care, and sports/leisure facilities; Guardianship",5,Euclidean Distance,1,"Previous Crime Location; Distance; Population Density; Single-Person Households; Non-Western Background; Retail Stores; Hotels Restaurants Bars; Schools; Culture, Health-Care, and Sports/Leisure Facilities; People Working",10,31
"BITING ONCE, TWICE: THE INFLUENCE OF PRIOR ON SUBSEQUENT CRIME LOCATION CHOICE *",NA,Marre Lammers; Barbara Menting; Stijn Ruiter; Wim Bernasco,NA,NA,"Lammers_Year_BitingOnceTwice.pdf (assuming ""Year"" is the publication year, which is not provided)",Netherlands,The greater The Hague area,2.96 km² (average size of each postal code area),Multiple types,2006,"Not explicitly mentioned, but implied to be after the offenses were committed",Four,Average size of 2.96 km²,142,"12,639 choice observations or events.","12,639 offenses.",Conditional logit,NA,"Prior crime locations strongly influence subsequent crime location choices, with stronger effects for frequent, recent, nearby, and same",Population Density; Proportion of Single-Person Households; Proportion of Residents with a Non-Western Ethnic Background,3,"Population density; Proportion of single-person households; Proportion of residents with a non-Western ethnic background; Number of retail stores; Number of hotels, restaurants, and bars; Number of people working",6,"Retail stores; Hotels, restaurants, and bars; Schools; Culture; Health care; Sports and leisure facilities; Number of people working",7,Distance to Prior Crime Location; Distance from Residential Area to Target Areas,2,Recency Variables; Residential Area Variables; Population Density; Proportion of Single-Person Households; Proportion of Non-Western Residents,5,23
Modeling Micro-Level Crime Location Choice: Application of the Discrete Choice Framework to Crime at Places,NA,Wim Bernasco,NA,NA,NA,Netherlands,Greater The Hague Area,400 sq. km,Residential burglary,2002,NA,Postal code areas,Approximately the size of a football field,"23,984","1,871 journey","1,311 burglaries",Multinomial logit,NA,The number of residential properties and proximity to the offender's home increase the likelihood of an area being chosen for burglary.,Number of Residents; Age Composition; Ethnic Composition,3,Average Value of Properties; Number of Residential Properties,2,Residential Units; Spatial Competition,2,Euclidean Distance; Physical Barriers; Journey-to-Crime Distance; Spatial Competition Variable; Home-to-Target Distance,5,Distance between burglar's home and target address; Number of residential units in postal code areas; Ethnic composition of population in postal code areas; Spatial competition variable,4,16
The Importance of Importance Sampling,NA,Wim Medvedev; Oleg N Polaschek; Sophie Curtis,NA,NA,NA,New Zealand,National,Not explicitly given,Non,2009,"Not explicitly mentioned, but implied to be during the study period",NZ Census Statistical Area 2 (SA2),"0.063 km² to 12,042.36 km² (median 1.962 km²)",2153,Random samples of 50% of the offenders within each offense type,NA,Conditional logit,R,Importance sampling is more consistent with full model results and computationally efficient compared to simple random sampling.,NA,0,Number of households in the SA2; Number of business units in any industry; Number of business units for industries targeted in commercial robbery; Number of commercial or public business units,4,Number of households in SA2; Number of business units in any industry; Number of business units for targeted industries; Number of commercial or public business units; Presence of activity nodes in SA2,5,Distance to Activity Nodes,1,Day-of-week effects; Time-of-day effects; Year dummies; Opportunity measures,4,14
CO-OFFENDERS' CRIME LOCATION CHOICE: DO CO-OFFENDING GROUPS COMMIT CRIMES IN THEIR SHARED AWARENESS SPACE?,NA,Marre Lammers,NA,NA,MarreLammers.pdf,The Netherlands,The greater The Hague region,2.96 km² (average size of four,"Various (most common: burglary, theft, public disorder crimes, assault)",2006,NA,Administrative unit (four,Average size of 2.96 km²,142,"2,926 groups of offenders.","6,283 crimes, with 3,612 co",Conditional logit,NA,Co,Total number of residents; Number of residents with a non-Western ethnic background; Number of single-person households; Population density,4,"Total number of residents; Number of residents with a non-Western ethnic background; Number of single-person households; Number of retail stores; Number of hotels, restaurants, bars, schools, cultural facilities, health care institutions, and sport and leisure facilities",5,Retail stores; Hotels; Restaurants; Bars; Schools; Cultural facilities; Health care institutions; Sport and leisure facilities; Population density,9,Home Location; Previous Home Location; Previous Crime Location,3,Area Characteristics; Home Location; Previous Home Location; Previous Crime Location; Shared Awareness Space,5,26
"Right place, right time? Making crime pattern theory time-specific",2021,Sabine E M Van Sleeuwen; Stijn Ruiter; Wouter Steenbeek,NA,NA,VanSleeuwen2021RightPlaceRightTime.pdf,Netherlands,The Hague and North,"Median area of neighbourhoods: 3.37 km², 14.5 km², 55.6 km²",Multiple types,2017,May to August 2019,Neighbourhood,"Median area = 0.66 km², Mean = 2.63 km², Range = 0.02","13,305",71 crimes.,71 unique crimes.,Conditional logit,NA,"Almost 40% of crimes are committed within offenders' activity nodes, increasing to 85% with surrounding areas.",NA,0,NA,0,Home occupancy in residential neighbourhoods; Number of cars parked on a parking lot; Presence of locks and escape routes; Residences; Schools; Jobs; Sports activities; Shopping; Going out; Neighbourhoods of offenders' activity nodes,10,Spatial Lags; Neighbourhood Proximity; Geocoded Neighbourhoods,3,Neighbourhood routinely visited at same time of day as crime event; Neighbourhood routinely visited at different time of day as crime event; Time of day; Crime committed in neighbourhood; Pseudo-R 2,5,18
Ambient population and surveillance cameras: The guardianship role in street robbers' crime location choice,2021,Dongping Long; Lin Liu; Mingen Xu; Jiaxin Feng; Jianguo Chen; Li He,Cities,NA,Long_2021_AmbientPopulationSurveillanceCameras.pdf,China,ZG City,"1971 communities, average size of 1.62 km²",Street robbery,2012,12,Administrative unit (communities),"Average size of 1.62 km², varies 0.001",1971,4358 street robbers.,"Implied to be related to 11,455 arrest records.",Conditional logit,STATA 13.0,"Ambient population and surveillance cameras significantly hinder street robbers' crime location choice, acting as guardians.",Hukou status; Proportion of migrants; Proportion of youngsters; Socioeconomic heterogeneity; Social cohesion; Collective efficacy; Types of housing,7,GDP; Annual Increase Rate; Socioeconomic Heterogeneity; Economic Inequality; Proportion of Youngsters,5,Malls and supermarkets; Grocers and terminal markets; Bars and clubs; Cybercafés and sports stadiums; High schools; ATMs and banks; Car parks; Surveillance cameras; Ambient population,9,Distance of Journey to Crime; Density of Road Network; Bus Stops; Transportation Hubs; Subway Stations,5,Crime generators and attractors; Density of road network; Distance of journey to crime; Social disorganization; Logged distance of journey to crime,5,31
Do Migrant and Native Robbers Target Different Places?,2021,Liu,ISPRS Int. J. Geo,NA,Liu2021DoMigrantAndNativeRobbersTargetDifferentPlaces.pdf,China,ZG City,1971 neighborhoods with an average area of 1.62 square kilometers,Street robbery,2012 to 2016,Arrest data: 2012 to 2016; POI data: 2014; Traffic road network vector map data: 2014; Bus stop data: 2015; Mobile phone data: May 2016; Census data: 2010,Neighborhood,1.62 square kilometers,1971,4358 street robbers (708 randomly selected migrant robbers and 708 native robbers).,7860 records involving 7124 unique offenders.,Conditional logit,Stata 13.0,Migrant robbers prefer labor,Gender; Ethnicity; Education level; Proportion of migrants; Proportion of youngsters; Socioeconomic heterogeneity; Daily human mobility; Migration status,8,Wholesale markets; Proportion of migrants; Socioeconomic heterogeneity,3,Labor-intensive industrial cluster; Old urban areas and urban villages; Wholesale markets; Sports stadiums; Malls and supermarkets; Grocers; Bars and clubs; High schools; ATMs and banks; Carparks; Bus stops; Density of road network,12,Distance of Journey to Crime,1,Arrest data; POI data; Traffic road network vector map data; Bus stop data; Mobile phone data; Distance of journey to crime; Ambient population; Crime prevention; Proportion of migrants,9,33
"Do juvenile, young adult, and adult offenders target different places in the Chinese context?",2022,Dongping Long; Lin Liu,NA,NA,Long_2022_Juvenile_Young_Adult_Adult_Offenders_Target_Different_Places_Chinese_Context.pdf,China,ZG city,1971 neighborhood units with an average area of 1.62 km²,Street robbery,2012,2012,Neighborhood units,1.62 km²,1971,7860 choice observations (street robberies).,7860 street robberies.,Conditional logit,NA,"Street robbers prefer areas frequented by their age group, close to their residence, and low in social cohesion.","Proportion of migrants; Proportion of young adults; Age groups (juvenile, young adult, adult); Social cohesion",4,Proportion of migrants; Proportion of young adults,2,Cybercafés; Schools; Wholesale markets; Bars and clubs; Routine activity nodes,5,Distance of Journey to Crime; Bus Stops; Subway Stations,3,Bus stops; Subway stations; Malls and supermarkets; Car parks,4,18
THE INFLUENCE OF ACTIVITY SPACE AND VISITING FREQUENCY ON CRIME LOCATION CHOICE: FINDINGS FROM AN ONLINE SELF-REPORT SURVEY,2019,Stijn Ruiter; Barbara Menting; Marre Lammers; Wim Bernasco,NA,NA,Ruiter2019ActivitySpace.pdf,Netherlands,Not specified (entire country),Not explicitly given (median neighbourhood size: 0.68 km²),"Multiple types (violent offences, thefts, vandalism, etc.)",2013,"May, June, and September 2016",Neighbourhood,Median size of 0.68 km² (range: 0.01,"12,821",140 offences,140,Conditional logit,NA,"Offenders are more likely to commit crimes in areas within their activity spaces, particularly in areas with frequently visited activity nodes.",Gender; Age; Residential Population Density; Employee Density; Median Residential Population,5,Residential Population Density; Employee Density,2,Residential population density; Employee density; Dominant land use function; Crime attractors; Visiting frequency,5,Proximity to Residential Area; Proximity to Activity Nodes; Distance Between Locations; Neighbourhood Boundaries,4,Time of Offense; Spatial Lag; Residential Population Density; Employee Density; Cluster-Corrected Standard Errors,5,21
Location Choice of Snatching Offenders in Chennai City,2021,K Kuralarasan; Wim Bernasco,NA,NA,Kuralarasan2021LocationChoiceSnatchingOffendersChennaiCity.pdf,India,Chennai City,2.18 km² (average surface area of 201 wards),Snatching (snatch theft),August 2010 to July 2017,"Not explicitly mentioned, but implied to be during the study period",Administrative unit (wards),Average surface area of 2.18 km² (range: 0.97 to 2.53 km²),201,1573 snatching offenses.,1573.,Conditional logit,NA,Snatching offenders prefer locations close to their residence and tend to re,Population size; Average population per ward; Age structure of offenders; Gender ratio of offenders,4,NA,0,"Retail businesses; Religious facilities (temples, churches, mosques); Educational institutions (schools, colleges); Marriage halls; Jewelry shops; Personal care facilities (barbershops, beauty parlors); Restaurants; Medical facilities (hospitals, medical services)",8,Home-to-crime distance; Journey to crime; Distance to ward centroids; Log-distance effect; Transport hubs; Public transport usage,6,Ward Area; Ward Population,2,20
AWARENESS × OPPORTUNITY: TESTING INTERACTIONS BETWEEN ACTIVITY NODES AND CRIMINAL OPPORTUNITY IN PREDICTING CRIME LOCATION CHOICE,2018,Barbara Menting,NA,NA,Menting_2018_Awareness_Opportunity.pdf,Netherlands,"The Hague, Rijswijk, and Leidschendam",1.68 km² (average area size),Any,2006,2009,Four,Average area size of 1.68 km² (range = 0.12,76,"13,088 choice observations.","13,088 crime incidents.",Conditional logit,NA,"Residential areas of offenders and family are more likely targeted, regardless of criminal opportunity.",Population size; Area size; Collective efficacy; Population density; Proportion of single-person households; Proportion of residents with a non-western background; Age of offenders; Gender of offenders,8,Number_of_Employees,1,Number of bars/restaurants/hotels; Collective efficacy,2,Euclidean Distance; Average Distance Replacement; Postal Code Areas; Travel Restrictions,4,"Former residential area of the offender; Distance between the offender's residential area and the crime location; Previous crime location; Crime year specific numbers of retail facilities, schools, cultural, health care, and sports/leisure facilities; Number of employees; Neighbourhood disorder; Population density; Proportion of single-person households; Proportion of residents with a non-western background",9,24
