Title,Authors,DOI,DOI link,Venue,Citation count,Year,THEORETICAL FRAMEWORK & OBJECTIVES,STUDY DESIGN & METHODOLOGY,DATA PREPARATION & PROCESSING,DEMOGRAPHIC & SOCIAL VARIABLES,ECONOMIC VARIABLES,"Supporting quotes for ""THEORETICAL FRAMEWORK & OBJECTIVES""","Supporting  tables for ""THEORETICAL FRAMEWORK & OBJECTIVES""","Reasoning for ""THEORETICAL FRAMEWORK & OBJECTIVES""","Supporting quotes for ""STUDY DESIGN & METHODOLOGY""","Supporting  tables for ""STUDY DESIGN & METHODOLOGY""","Reasoning for ""STUDY DESIGN & METHODOLOGY""","Supporting quotes for ""DATA PREPARATION & PROCESSING""","Supporting  tables for ""DATA PREPARATION & PROCESSING""","Reasoning for ""DATA PREPARATION & PROCESSING""","Supporting quotes for ""DEMOGRAPHIC & SOCIAL VARIABLES""","Supporting  tables for ""DEMOGRAPHIC & SOCIAL VARIABLES""","Reasoning for ""DEMOGRAPHIC & SOCIAL VARIABLES""","Supporting quotes for ""ECONOMIC VARIABLES""","Supporting  tables for ""ECONOMIC VARIABLES""","Reasoning for ""ECONOMIC VARIABLES"""
TARGET CHOICE DURING EXTREME EVENTS: A DISCRETE SPATIAL CHOICE MODEL OF THE 2011 LONDON RIOTS *,"Peter Baudains, Alex Braithwaite, Shane D Johnson",-,-,,85,2013,"- **Theoretical Framework:** Crime pattern theory, social disorganization theory, and theories of collective behavior and contagion.
- **Research Objectives:** To understand the spatial decision making of rioters and to test the applicability of these theories in the context of riots.
- **Literature Gap:** The lack of understanding of how these theories apply to extreme events like riots.
- **Study Motivation:** To advance understanding of rioter spatial decision making and to provide insights into vulnerable areas during riots.","- Study Design: Cross-sectional
- Discrete Choice Model: Conditional logit
- Model Specification: Random utility model
- Software Used: STATA 10 SE
- Estimation Method: Maximum likelihood
- Model Extensions: Random parameters, spatial effects","- **Data Cleaning:** No offender appears more than once in the data; duplicates were eliminated.
- **Variable Construction:** Distance between residence and offense location calculated using Euclidean distance; population churn rates, ethnic heterogeneity, and deprivation derived from census data and official sources.
- **Missing Data Handling:** Incomplete records excluded from analysis; only records with complete residential and offense location data were used.
- **Data Integration:** Data from Metropolitan Police Service integrated with U.K. Census and other government sources.
- **Quality Control:** Use of official data sources like U.K. Census and Metropolitan Police Service ensures data reliability and accuracy.","1. Population Churn Rates | Measure of population movement | Unit: Derived from 2001 U.K. Census | Data_Source: 2001 U.K. Census
2. Ethnic Heterogeneity | Measure of ethnic diversity | Unit: Index of qualitative variation | Data_Source: 2001 U.K. Census
3. Number of Schools | Count of secondary schools | Unit: Number | Data_Source: U.K. Department of Education
4. Age Distribution | Age structure of offenders | Unit: Age spectrum | Data_Source: Police data
5. Propinquity | Distance from home to offense location | Unit: Kilometers | Data_Source: Police data
6. Social Disorganization | Influence on spatial decision making | Unit: Theoretical framework | Data_Source: Theoretical discussion",1. Index of Multiple Deprivation (IMD) | Economic deprivation index | Unit: 10 unit increase | Data_Source: U.K. Department for Communities and Local Government,"  - ""In the current study, we derive and test a set of expectations regarding rioter spatial decision making developed from theories originally intended to explain patterns of urban crime when law and order prevail—crime pattern and social disorganization theory—and consider theories of collective behavior and contagion.""
  - ""The results demonstrate that rioter target choices were far from random and provide support for all three types of theory, but for crime pattern theory in particular.""
  - ""To examine this issue, we explore the spatial distribution of the riots that occurred in London during August 2011.""
  - ""The aim of the current article was to advance understanding of the spatial decision making of rioters and to consider the utility of different theoretical accounts.""
  - ""the findings provide insight into the types of areas that may be most vulnerable during riots and why this is the case, and when particular areas are likely to be at an elevated risk of this type of disorder.""
  - ""The results also provide some support for theories of social disorganization as influencing the spatial decision making of rioters.""
  - ""the current study provides further support to suggest that the choices made by rioters are not irrational.""",,"- The study builds on criminological theories such as crime pattern theory, social disorganization theory, and theories of collective behavior and contagion, as indicated by the first quote.
- The main research objective is to understand the spatial decision making of rioters and to test the applicability of these theories in the context of riots, as stated in the second and third quotes.
- The literature gap addressed by this study is the lack of understanding of how these theories apply to extreme events like riots, as implied by the fourth quote.
- The study motivation is to advance understanding of rioter spatial decision making and to provide insights into vulnerable areas during riots, as mentioned in the fifth and sixth quotes.
- The study also aims to challenge the notion that rioter behavior is irrational by providing evidence that their choices are influenced by rational decision-making processes, as suggested by the last quote.","  - ""Unlike most studies of victimization, we use a random utility model to examine simultaneously how the features of the destinations selected by rioters, the origins of their journeys, and the characteristics of the offenders influence offender spatial decision making.""
  - ""In this section, we discuss the approach, starting with a few examples to illustrate the logic of the method, and then we describe the statistical model applied. Regarding theoretical models of utility in criminology, rational choice theory (Cornish and Clarke, 1986) explicitly considers offender decision-making processes at the event level.""
  - ""In terms of formal methods for modeling decision making of this kind, the discrete choice approach is a class of model that concerns an individual's choice between a set of two or more discrete alternatives (for an overview, see Train, 2003).""
  - ""All models are estimated using STATA 10 SE (StataCorp, College Station, TX).""
  - ""The estimates of population churn rates and ethnic heterogeneity were derived using data from the 2001 U.K. Census.""
  - ""The results presented are robust to the inclusion of two other variables: a measure of police strength and a measure of police relations in the destination areas.""",,"- The study uses a ""random utility model"" to examine the spatial decision making of rioters, which is a type of discrete choice model.
- The discrete choice approach is used to model the choice between multiple discrete alternatives, which aligns with the use of a conditional logit model.
- The model specification is based on a random utility model, which is a common specification for discrete choice models.
- The software used for estimation is STATA 10 SE, which is a statistical software package.
- The estimation method is maximum likelihood, as indicated by the use of the conditional logit model and the mention of McFadden's work.
- The model includes various extensions such as the consideration of population churn rates and ethnic heterogeneity, which are part of the model specification.","  - ""The police data consist of all offenses that were detected, and that were identified as having been associated with the riots, by the Metropolitan police for the period August 6-11, 2011.""
  - ""Each record contained an identifier of the area within which the offense took place, the area in which the offender was recorded as living, the date and time at which the offense was estimated to have occurred, and the age of the offender.""
  - ""No offender appears in the data more than once.""
  - ""Of the available data (N = 3,914), 2,299 records contained entries for both the residential and the offense location. Only these data were used in the analysis,""
  - ""To implement the discrete choice model, it was necessary to calculate the distance between the LSOA within which each offender was recorded as living and the LSOA in which he or she committed the offense.""
  - ""To do this, in line with previous research of this kind, we computed the Euclidean distance between the LSOA centroids for these origin and destination areas.""
  - ""The estimates of population churn rates and ethnic heterogeneity were derived using data from the 2001 U.K. Census.""
  - ""To measure deprivation, we use the Index of Multiple Deprivation (IMD) 2010 obtained from the U.K. Department for Communities and Local Government""
  - ""The variable was operationalized using mid-2010 population estimates for LSOAs, obtained from the U.K. Office for National Statistics.""
  - ""Finally, to measure the effect that prior offenses at a location have on the spatial decision making of a new potential rioter, for each event level decision, we count the number of detected offenses that were identified by the police as having been associated with the riots that occurred at each LSOA within the previous 24 hours of that decision.""",,"- **Data Cleaning:** The data was cleaned by ensuring that no offender appears more than once in the dataset, which suggests a process to eliminate duplicates.
- **Variable Construction:** Key variables such as distance between residence and offense location were calculated using Euclidean distance between LSOA centroids. Other variables like population churn rates, ethnic heterogeneity, and deprivation were derived from census data and other official sources.
- **Missing Data Handling:** The paper mentions that only records with complete information for both residential and offense locations were used, indicating that incomplete records were excluded from the analysis.
- **Data Integration:** The study integrated data from the Metropolitan Police Service with data from the U.K. Census and other government sources to create a comprehensive dataset.
- **Quality Control:** The use of official data sources like the U.K. Census and the Metropolitan Police Service suggests a level of quality control in terms of data reliability and accuracy.","  - ""The estimates of population churn rates and ethnic heterogeneity were derived using data from the 2001 U.K. Census.""
  - ""The number of key stage 4 schools (roughly equivalent to secondary schools for those 11-16 years of age) in each LSOA is counted using data from the U.K. Department of Education.""
  - ""A large proportion of the offenders is younger than 20 years of age; however, offenders across the age spectrum are represented, creating the skewed distribution observed-a distribution that is very similar to the typical age-crime curve""
  - ""The results suggest an unequivocal effect of propinquity (hypothesis 1) on offender spatial decision making, with offenders (young or old) being more likely to target areas that were closer to their area of residence.""
  - ""the odds of an offender selecting an area increases by a factor of between 1.29 and 2.09 for every additional school that is located within it""
  - ""The variable used to measure contagion (hypothesis 11)-indicating the number of offenses in each area in the previous 24 hours-was significantly associated with target choice during the London riots,""
  - ""The results also provide some support for theories of social disorganization as influencing the spatial decision making of rioters.""",,"- The paper discusses several demographic and social variables relevant to the study.
- Population churn rates and ethnic heterogeneity are explicitly mentioned as variables derived from the 2001 U.K. Census, which are demographic and social structure variables.
- The number of schools is a social structure variable related to education.
- The age distribution of offenders is a demographic variable, as it describes the age structure of the population involved in the riots.
- The effect of propinquity (distance from home) is related to social processes, as it influences spatial decision making.
- The mention of social disorganization theories suggests that social cohesion and collective efficacy are considered, although not explicitly quantified in the provided quotes.
- The contagion variable, while not strictly demographic or social, is related to social processes as it involves the influence of recent events on behavior.","  - ""To measure deprivation, we use the Index of Multiple Deprivation (IMD) 2010 obtained from the U.K. Department for Communities and Local Government (McLennan et al., 2011).""
  - ""the odds of an area being selected increases by a factor of between 1.27 and 1.63 for every 10 unit increase in the index of deprivation.""
  - ""All other things being equal, areas with higher estimated levels of deprivation (hypothesis 10) were more likely to be selected on each day of the riots.""",,"- The paper mentions the use of the Index of Multiple Deprivation (IMD) 2010 as a measure of deprivation. This is a clear economic variable related to economic status and prosperity.
- The IMD is used to assess the economic deprivation of areas, which is a key economic status measure.
- The paper discusses how areas with higher deprivation levels were more likely to be targeted during the riots, indicating that economic status was a factor in target choice.
- The IMD is a widely recognized economic deprivation index, making it a relevant economic variable in this context."
